name,star,comment
邵禹升,推荐,"这四星皆是给龙虎武师的精神。有一个可笑的点，就是斧头帮群殴那场戏，整场透露着尬。看着一匹马带动向前努力的情绪，就让人有点别扭。大哥整部电影最重要的内核就是龙虎武师为华语电影做的贡献，简直是伟大二字了。这行当为动作电影做的贡献是无法用金钱衡量的，回望过往，全部都是价值。余皑磊是值得赞扬的，他的戏无论什么角色，可塑性太强太强，只要你留意了会发现，有他在就是精彩！"
未洋chaos,推荐,成龙大哥还是那么优秀，他真的是中国最后一位功夫巨星了，很感动，这个年纪依然如此拼。那个年代龙虎武师的精神，值得大家学习。各个角色的演技其实也是可圈可点，希望中国功夫电影可以不断传承下去，而不是留在记忆里！
灰尘勿扰,还行,好题材，可惜了。动真情的成龙+糟糕的故事情节设计+浮于表面的片段式表达+必定合家欢的结局设置。无论如何，以成龙为代表的龙虎武师精神真的令人动容，这一切刻在胶片上将被永远记忆！
拾麦人,很差,在刘浩存面前，看得出来成龙很努力
张三其人,还行,还是献给情怀和马的戏的难度，成龙半自传电影对自己的自白和反思，收手吧以这部结尾刚好，剧本实在太烂了，一直觉得刘浩存没批评地那么差，在杨子手下原型暴露了。
yungkey,很差,没看完走了
David&Movie,推荐,还不错，看一部少一部系列。之前看过龙虎武师的纪录片，那个香港动作片吊打好莱坞的八九十年代，每一个镜头都是拼出来的。本片致敬了很多成龙元素，还再现了几场经典的成龙式动作戏，以及到位的父女父子感情戏，不错不错，期待下尖峰时刻4
豆瓣天后董小姐,推荐,泪目！电影中“你们那个时代已经过去了”这句台词让人唏嘘感伤，成龙大哥在首映现场说，只要能拍得动，不管有没有人看，他都会坚持。这一次，69岁的华人之光，真打真摔本色出演龙虎武师，虽是熟悉的味道，却又有了新的感动。
爱琳,还行,跳下来容易，走下来难
羽生结衣,推荐,虽说都是人和动物感情戏的常用表现手段，但赤兔和老罗的情感铺垫到位，就是贼感动
或者雪,较差,父女线写得太次了
活豪,力荐,赤兔蛮讨喜的，聪明伶俐通人性，老罗和赤兔是家人般的存在吧，看赤兔讨喜的样子想起我家小狗了，也是一样可爱
See,很差,怎么不算呢？
华盛顿樱桃树,较差,全片最好看的部分，是大哥过往动作戏的受伤画面，那是真的不屈不挠真的鼓舞人。一转头回来就连刘浩存的那场哭戏竟然都不那么令人讨厌了，足见真实的力量。除此之外就都是假大空和老派的动作戏和剧情设置。就是你永远都会知道接下来会发生什么。最后致敬的群体没得说，就是能拍得再好点就更好了。
和大人,推荐,"刘浩存一张口说话感觉智商都没马高！(四颗星只给今天69岁的成龙）"
韦恩斯坦_李,推荐,可以说是成龙大哥的粉丝电影吧，致敬了成龙大哥自己，看到好多熟悉的造型和场景，同时也是致敬武行这个行当，确实很不容易？年近70的成龙大哥还在拍打戏，这体力这精神让人敬佩，也让人想起小时候看过的他那些精彩的电影。所以即使电影有不少问题，也值得向大哥致敬一下！
溴化雞,还行,电影首映当天看的，当时就想评分，但有一说一，这电影看得让我无以复加的纠结。电影本身除了接近结尾那不让用特效但实际又用了特效的不知道是不是自黑的桥段之外，其实没太大问题，完全在接受范围内。但看电影的每时每刻我都能不由自主地联想到：①小龙女；②刘浩存“天真无邪”的那句“怎么不算呢”(别人采访她算不算有天赋时她的回答)；③罪犯子女是否可以考公(刘浩存的老赖父母 当然老赖不等同于罪犯)；④就这样的龙叔还要拍尖峰时刻4神话2等等大片。这一对比一联想一出戏我就真的、着实纠结死了，感觉自己心里真的就有两个人在对抗一样，太特么煞笔了。
向阳南木,还行,很平庸，尤其是矛盾设置和剧情转折不太行。不是打感情牌就代表可以。。。
爱翾,还行,自从伦敦营救就开始煽情了，而且每次有点惨，还是喜欢以前轻松幽默的感觉，可是大哥年龄大了，后继无人，很可惜，以后不知道看啥了。有点没劲，倒是里面一些以前的片段看着又想回顾了。龙虎武师很佩服，真是拼命，也心疼，现在技术是发达，可那种感觉也的确没了，挺矛盾的，替身，马啊动物啊什么的安全问题，和电影质量问题。父女俩那么多年的冰说破就破，马儿说站就站起来，说两句就重新上场了，鼓鼓劲就能完成艰难任务了，现实呢？看以前大哥受伤很难过，可他现在的地位就是这么拼出来的。女儿的指责有点是，却又有点不知所谓，亲家家的确是好人，接受。整部剧其实就郭麒麟看着很舒服很有笑点了，哦，老大也还行。
和寂寞一起悬空,推荐,跳下去容易，走起来难
PAMBO,还行,大横店nb（和我头像同个景6）
蒙奇D,还行,郭麒麟在大银幕上胖得像充气的。电影里对于父母情的刻画有点儿戏，特别是有几段和好和闹别扭几乎没有情绪铺垫，太牵强。人和马的感情反而稍微正常一点，马为了报恩，心甘情愿听人使唤，危险也不怕。不过，几次马的下跪也太夸张了。最后是成龙对龙虎武师的致敬，和对自己的致敬，这部分还是挺感人的，看的时候会带入纪录片《龙虎武师》的情绪，情怀这部分有加分。但是，如果成龙以这部电影作为致敬自己的终章，也未免太遗憾了，这导演也拍得太差了。六分完全是给打不动的成龙，需要替身和后期CG制作的成龙。真人真打的动作片时代过去了，我会想念它。
Avocado Lake,很差,成龙大哥，转型不了要不就不拍了吧，找一群演得更烂演的不像人的并不能显得你演技就好了。老艺术家吃点烂钱无可厚非…但对手戏看着实在心疼。1星赞给一如既往的片尾花絮
AL Rorschach,推荐,你永远可以相信赤兔，就算会因为众人围堵而害怕，仍会为了老罗冲破重围，养宠物的真的遭不住呜呜呜
jxw611,还行,"打三星中合一下分数，成龙近年作品故事完整度最佳，可以想见其他片剧情线得拉胯成什么样。
女主演技是硬伤，该有的情绪一概没有。故事可以看做是成龙的自我致敬之作，片场历险记还有阿龙和赤兔之间的互动展开写写就好了。
现在的成龙需要一个何冠昌+陈自强式的人物给他选选剧本，更改一下路线，别老靠以前的辉煌活着。就像片里的主角，最后的特技镜头也玩不转了。"
夜帘墨影,还行,要素过多，剧本太拉，本来也没抱什么期待，给龙叔补的电影票，在里面找彩蛋也挺好的，给个人情分吧。
影子的影子,较差,把刘浩存那一条线都删了会好看一点，如果硬要保留这条父女线也应该改改人设，让女儿直接做律师帮父亲打官司对人物关系才更有促进吧（虽然不管怎么改联系现实里的成龙父女关系都会有点膈应就是了）杨子真的还是那点东西，动不动就上音乐煽情，每一个煽情点都能精准预测到但他仍旧乐此不疲，一个片煽那么多次你是不是还挺得意？动作戏比文戏好看一百倍吧，依旧是信手拈来利用身边一切道具的功夫喜剧，好几场打斗的设计还挺有意思的。
王堃,推荐,救命，好喜欢赤兔，赤兔必须是全世界最聪明的马了，没有之一😭😭😭让我想起我家狗子了呜呜呜
困在坚果壳里,力荐,好的影片看完就是后劲很足，感动于老罗和赤兔的重逢，感动于龙虎武师永不言弃的精神，感动于还能在影院看到大哥精彩的打戏
座山雕,推荐,老罗带着赤兔大战好多黑衣人那段真的真的太帅了！！
五溪,力荐,他奶奶滴哭惨了有笑有泪够看😭我就知道龙哥的电影不会让我这种人失望 最大问题我就是不喜欢那个什么存以及她的配音是真难受啊还出戏  龙哥的武打动作真的很难想象已经69岁高龄了上一代我们这一代也许下一代都会特别喜欢  龙虎武师的意义 确实 电影的主题表达很到位 我就是很喜欢😭而且能体现内容很多 但最喜欢的还是赤兔的通人性  人和动物之间真的是一种很奇妙的友谊🥹  
乌鸦炸酱面🍧,较差,很难受，马的演技比人好。抠出一座魔法城堡。
建邺城牛大胆,较差,成龙是不是忘了自己有个女儿
蜗牛小姐🐌,力荐,成龙的演绎有打动人心的力量，一举一动都特别真实接地气，我深深被成龙的演技感染到了，后半场一直在哭谁懂……
胡桃树,推荐,好喜欢赤兔啊，是个好伙伴，看自己“老爹”受欺负了还会踹人，它和老罗的双向奔赴真是太好哭了，好想养（bushi
老白,力荐,很有人情味的一部电影，很少能看到成龙演这么走心的电影，挺值得一看的
北方 知寒,力荐,情怀无价
赵找找,较差,1.父女线有些莫名其妙，怎么就不理了，怎么又理了？2.这个电影是在讲什么？龙虎武师精神吗？人和动物的感情吗？没整明白啊所以无法安放观影心情；3.看着大哥一脸褶子打架，真心酸。
heros never 岱,推荐,"前半段对情绪点的把握基本上全部扑街，过快的节奏导致观众完全没有情绪共鸣，大量这父女俩为啥突然又和好了，为啥突然又闹掰了的疑问让观众尴尬到脚趾抠地，但后半段人与马之间的情感表达又基本上恰到好处，让我不禁想说这导演不是会抒情吗？希望前半段节奏的崩裂是制片方对时长要求而妥协的结果吧。
最大的优点在于对“龙虎武师精神”的升华，从一味追求实拍转变为为了热爱可以拼命，同时也回归到了父亲可以为女儿拼命上面。
有很多对老电影、老导演和老演员的致敬
因为龙叔所以多加一星"
Nirvanania,很差,陈旧
雾都一枝花儿,较差,真的很胡闹😿
KK,较差,煽情太多了。成龙的奋斗史固然让人尊敬，不过没必要绑定这个龙虎武师故事和父女情，好多故事转折很突然，满满顿挫感。一边流泪一边清晰认知它作为电影的不够格，但那句“我不要你了”还是很让人难过，能记起的被泪浸湿的梦里总会有这句，真奇怪啊...
陪顾海渡过漫长,较差,评论都好假
啊柒,很差,1.5，得了吧别一天到晚的龙虎武师了，要不是免费看的，我说你这片是三脚猫武师还不为过。我是打从根本上怀疑这部片子的编剧是吃干饭的，所谓的龙虎武师精神在他那块就是刻板的拼命拼命再拼命，至于家人，编剧想他们感情好他们就好，不想他们好就反目成仇，拍拍脑袋想一出来一出。就好像在抖音短视频上看到什么段子好玩，什么段子感人就使劲怼，完了BGM铺满，摁着观众的头都给我气，给我哭，起承转合完全没有，官司都没弄明白到底从头到尾打的是咋一连串回事。说不是就不是，一点铺垫都没有，就突然生离死别，就跟《人生大事》的最后一段送回亲妈那般令人一头雾水，看得只想骂街了。同样不得不提的，出道三年了，刘浩存她都干嘛去了，真是令人好奇啊，三年时间都足够时间让一个小孩子学会牙牙学语了，她竟然一点进步都没有。听她说话我全程难受。
许一一,还行,这位龙虎武师最重要的成长就是意识到他不是一名马师
